{
  "schema_version": 1,
  "document_id": "11111111-1111-4111-8111-111111111111",
  "run_id": "22222222-2222-4222-8222-222222222222",
  "revision": 1,
  "cards": [
    {
      "lo_id": "77777777-7777-4777-8777-777777777777",
      "position": 0,
      "title": "Phân tích yêu cầu",
      "key_insight": "Yêu cầu chức năng mô tả hệ thống phải làm gì.",
      "bullets": ["Xác định tác nhân", "Xác định use case"],
      "source_chunk_ids": ["12345678-1234-4234-8234-123456789012"],
      "model_id": "gemini/gemini-3-flash-preview"
    }
  ],
  "quiz_items": [],
  "concepts": [
    {
      "concept_id": "23456789-2345-4345-8345-234567890123",
      "name": "Phân tích yêu cầu",
      "description": "Bước đầu của vòng đời phát triển phần mềm.",
      "aliases": ["requirements analysis"]
    }
  ],
  "chunk_concepts": [
    {
      "chunk_id": "12345678-1234-4234-8234-123456789012",
      "concept_id": "23456789-2345-4345-8345-234567890123",
      "mention_count": 2,
      "position": 0
    }
  ]
}
